{
  "agent_id": "discovery-call-specialist",
  "version": "1.0.0",
  "last_updated": "2025-10-24T07:20:05.864225",
  "metrics": {
    "core_performance": {
      "total_invocations": 0,
      "successful": 0,
      "failed": 0,
      "success_rate": 0.0
    },
    "time_performance": {
      "avg_time_seconds": 0.0,
      "target_time_seconds": 300
    },
    "reflection_quality": {
      "correction_rate": 0.0,
      "reflection_depth": {
        "shallow": 0,
        "deep": 0
      }
    },
    "pattern_effectiveness": {},
    "user_satisfaction": {
      "average_rating": 0.0,
      "positive_feedback": 0,
      "neutral_feedback": 0,
      "negative_feedback": 0
    }
  },
  "evolution_history": [],
  "learnings": [],
  "improvement_recommendations": []
}